{"schema_version":1,"cik":"0000320193","ticker":"AAPL","accession_no":"0000320193-26-000018","form_type":"8-K","filed_date":"2026-07-30","section":"press_release","source_document":"EX-99.1","title":"Apple reports third quarter results","text":"Apple reports third quarter results \n \nJune quarter records for total company revenue and EPS\n\niPhone, Mac and Services revenue set new June quarter records\n\nCUPERTINO, CALIFORNIA — Apple ® today announced financial results for its fiscal\n2026 third quarter ended June 27, 2026. The Company posted quarterly revenue of\n$109.4 billion, up 16 percent year over year. Company gross margin was 50.1\npercent, including a favorable impact of approximately 2 percentage points from\ntariff refunds. Diluted earnings per share was $2.02, up 29 percent year over\nyear, and included a favorable impact of $0.11 from tariff refunds.\n\n“Today, Apple is proud to report our strongest June quarter ever, with double-\ndigit revenue growth across iPhone, Mac and Services, and in every geographic\nsegment,” said Tim Cook, Apple’s CEO. “At WWDC26, we were thrilled to introduce\nthe all-new Siri AI, alongside all of Apple’s latest software innovations and\nimportant new child safety features.”\n\n“We are very pleased with our record business performance during the quarter,\nwhich set new June quarter records for both EPS and operating cash flow,” said\nKevan Parekh, Apple’s CFO. “Our installed base of active devices also reached a\nnew all-time high across all major product categories and geographic segments.”\n\nApple’s board of directors has declared a cash dividend of $0.27 per share of\nthe Company’s common stock. The dividend is payable on August 13, 2026, to\nshareholders of record as of the close of business on August 10, 2026.\n\nApple will provide live streaming of its Q3 2026 financial results conference\ncall beginning at 2:00 p.m. PT on July 30, 2026, at apple.com/investor/earnings-\ncall. The webcast will be available for replay for approximately two weeks\nthereafter.\n\nApple periodically provides information for investors on its corporate website,\napple.com, and its investor relations website, investor.apple.com. This includes\npress releases and other information about financial performance, reports filed\nor furnished with the SEC, information on corporate governance, and details\nrelated to its annual meeting of shareholders.\n\nThis press release contains forward-looking statements, within the meaning of\nthe Private Securities Litigation Reform Act of 1995. These forward-looking\nstatements include without limitation those about payment of the Company’s\nquarterly dividend and future business plans. These statements involve risks and\nuncertainties, and actual results may differ materially from any future results\nexpressed or implied by the forward-looking statements. Risks and uncertainties\ninclude without limitation: effects of global and regional economic conditions,\nincluding as a result of government policies, trade and other international\ndisputes, geopolitical tensions, conflict, terrorism, natural disasters, and\npublic health issues; risks relating to the design, manufacture, introduction,\nand transition of products and services in highly competitive and rapidly\nchanging markets, including from reliance on third parties for components,\ntechnology, manufacturing, applications, services, support, and content; risks\nrelating to information technology system failures, network disruptions, and\nfailure to protect, loss of, or unauthorized access to, or release of, data; and\neffects of unfavorable legal proceedings, government investigations, and complex\nand changing laws and regulations. More information on these risks and other\npotential factors that could affect the Company’s business, reputation, results\nof operations, financial condition, and stock price is included in the Company’s\nfilings with the SEC, including in the “Risk Factors” and “Management’s\nDiscussion and Analysis of Financial Condition and Results of Operations”\nsections of the Company’s most recently filed periodic reports on Form 10-K and\nForm 10-Q and subsequent filings. The Company assumes no obligation to update\nany forward-looking statements, which speak only as of the date they are made.\n\nApple revolutionized personal technology with the introduction of the Macintosh\nin 1984. Today, Apple leads the world in innovation with iPhone, iPad, Mac,\nAirPods, Apple Watch, and Apple Vision Pro. Apple’s six software platforms —\niOS, iPadOS, macOS, watchOS, visionOS, and tvOS — provide seamless experiences\nacross all Apple devices and empower people with breakthrough services including\nthe App Store, Apple Music, Apple Pay, iCloud, and Apple TV. Apple’s more than\n150,000 employees are dedicated to making the best products on earth and to\nleaving the world better than we found it.\n\nPress Contact:\n\nJosh Rosenstock\n\nApple\n\njrosenstock@apple.com\n\n(408) 862-1142\n\nInvestor Relations Contact:\n\nSuhasini Chandramouli\n\nApple\n\nsuhasini@apple.com\n\n(408) 974-3123\n\nNOTE TO EDITORS: For additional information visit Apple Newsroom\n(www.apple.com/newsroom), or email Apple’s Media Helpline at\nmedia.help@apple.com.\n\n© 2026 Apple Inc. All rights reserved. Apple and the Apple logo are trademarks\nof Apple. Other company and product names may be trademarks of their respective\nowners.\n \n Apple Inc. \n \n \n CONDENSED CONSOLIDATED STATEMENTS OF OPERATIONS (Unaudited) \n \n (In millions, except number of shares, which are reflected in thousands, and \n per-share amounts) \n \n Three Nine \n Months Months \n Ended Ended \n June 27, June 28, June 27, June 28, \n 2026 2025 2026 2025 \n ────────────────────────────────────────────────────────────────────────────── \n Net \n sales: \n Products $ 78,678 $ 66,613 $ 272,629 $ 233,287 \n Services 30,739 27,423 91,728 80,408 \n Total net 109,417 94,036 364,357 313,695 \n sales(1) \n Cost of \n sales: \n Products 47,153 43,620 163,810 147,097 \n Services 7,494 6,698 21,765 19,738 \n Total \n cost of 54,647 50,318 185,575 166,835 \n sales \n Gross 54,770 43,718 178,782 146,860 \n margin \n Operating \n expenses: \n Research \n and 11,729 8,866 34,035 25,684 \n developm… \n Selling, \n general 7,346 6,650 22,315 20,553 \n and \n administ… \n Total \n operating 19,075 15,516 56,350 46,237 \n expenses \n Operating 35,695 28,202 122,432 100,623 \n income \n Other \n income/(… 572 -171 670 -698 \n net \n Income \n before \n provision 36,267 28,031 123,102 99,925 \n for \n income \n taxes \n Provision \n for 6,478 4,597 21,638 15,381 \n income \n taxes \n Net $ 29,789 $ 23,434 $ 101,464 $ 84,544 \n income \n Earnings \n per \n share: \n Basic $ 2.03 $ 1.57 $ 6.91 $ 5.64 \n Diluted $ 2.02 $ 1.57 $ 6.88 $ 5.62 \n Shares \n used in \n computing \n earnings \n per \n share: \n Basic 14,656,110 14,902,886 14,692,515 14,992,8… \n Diluted 14,714,676 14,948,179 14,750,302 15,051,7… \n (1)Net \n sales by \n reportab… \n segment: \n Americas $ 45,781 $ 41,198 $ 149,403 $ 134,161 \n Europe 29,395 24,014 95,596 82,329 \n Greater 18,816 15,369 64,839 49,884 \n China \n Japan 6,554 5,782 24,368 22,067 \n Rest of \n Asia 8,871 7,673 30,151 25,254 \n Pacific \n Total net $ 109,417 $ 94,036 $ 364,357 $ 313,695 \n sales \n (1)Net \n sales by \n category: \n iPhone $ 54,252 $ 44,582 $ 196,515 $ 160,561 \n Mac 10,352 8,046 27,137 24,982 \n iPad 6,191 6,581 21,700 21,071 \n Wearable… \n Home and 7,883 7,404 27,277 26,673 \n Accessor… \n Services 30,739 27,423 91,728 80,408 \n Total net $ 109,417 $ 94,036 $ 364,357 $ 313,695 \n sales \n \n \n Apple Inc. \n \n \n CONDENSED CONSOLIDATED BALANCE SHEETS (Unaudited) \n \n(In millions, except number of shares, which are reflected in thousands, and par\n value) \n \n June 27, September 27, \n 2026 2025 \n ───────────────────────────────────────────────────────────────────────────── \n ASSETS: \n Current assets: \n Cash and cash equivalents $ 39,544 $ 35,934 \n Marketable securities 22,855 18,763 \n Accounts receivable, net 31,398 39,777 \n Vendor non-trade receivables 27,509 33,180 \n Inventories 11,092 5,718 \n Other current assets 17,420 14,585 \n Total current assets 149,818 147,957 \n Non-current assets: \n Marketable securities 84,118 77,723 \n Property, plant and equipment, net 51,431 49,834 \n Intangible assets, net 20,342 11,093 \n Other non-current assets 77,557 72,634 \n Total non-current assets 233,448 211,284 \n Total assets $ 383,266 $ 359,241 \n LIABILITIES AND SHAREHOLDERS’ EQUITY: \n Current liabilities: \n Accounts payable $ 64,525 $ 69,860 \n Other current liabilities 62,259 66,387 \n Deferred revenue 9,538 9,055 \n Commercial paper 1,997 7,979 \n Term debt 11,007 12,350 \n Total current liabilities 149,326 165,631 \n Non-current liabilities: \n Term debt 71,340 78,328 \n Other non-current liabilities 55,080 41,549 \n Total non-current liabilities 126,420 119,877 \n Total liabilities 275,746 285,508 \n Commitments and contingencies \n Shareholders’ equity: \n Common stock and additional paid-in \n capital, $0.00001 par value: \n 50,400,000 shares authorized; 14,608,963 100,702 93,568 \n and 14,773,260 shares issued and \n outstanding, respectively \n Retained earnings/(Accumulated deficit) 11,326 -14,264 \n Accumulated other comprehensive loss -4,508 -5,571 \n Total shareholders’ equity 107,520 73,733 \n Total liabilities and shareholders’ $ 383,266 $ 359,241 \n equity \n \n \n Apple Inc. \n \n CONDENSED CONSOLIDATED STATEMENTS OF CASH FLOWS (Unaudited) \n \n (In millions) \n \n Nine Months Ended \n June 27, June 28, \n 2026 2025 \n ────────────────────────────────────────────────────────────────────────────── \n Cash, cash equivalents, and \n restricted $ 35,934 $ 29,943 \n cash and cash equivalents, beginning \n balances \n Operating activities: \n Net income 101,464 84,544 \n Adjustments to reconcile net income \n to \n cash generated by operating \n activities: \n Depreciation and amortizatio